[
  {
    "node_id": "NODE-POSTCONVICTION-REMEDY-CLASSIFICATION",
    "label": "Classify remaining post-conviction relief",
    "node_type": "decision",
    "module_id": "MOD-EXTRAORDINARY-WRITS-CORAM-AUDITA-MANDAMUS",
    "claim_ids": [
      "CLM-XWRIT-016",
      "CLM-CLEM-004"
    ],
    "jurisdiction": "federal_nationwide"
  },
  {
    "node_id": "NODE-CORAM-NOBIS-SCREEN",
    "label": "Apply Morgan and controlling-circuit coram nobis gates",
    "node_type": "decision",
    "module_id": "MOD-EXTRAORDINARY-WRITS-CORAM-AUDITA-MANDAMUS",
    "claim_ids": [
      "CLM-XWRIT-008",
      "CLM-XWRIT-009",
      "CLM-XWRIT-010",
      "CLM-XWRIT-011",
      "CLM-XWRIT-012",
      "CLM-XWRIT-014",
      "CLM-XWRIT-015",
      "CLM-XWRIT-016"
    ],
    "jurisdiction": "federal_convicting_court"
  },
  {
    "node_id": "NODE-CORAM-NOBIS-FILING",
    "label": "File supported coram nobis request in the convicting court",
    "node_type": "filing",
    "module_id": "MOD-EXTRAORDINARY-WRITS-CORAM-AUDITA-MANDAMUS",
    "claim_ids": [
      "CLM-XWRIT-005",
      "CLM-XWRIT-006",
      "CLM-XWRIT-017"
    ],
    "jurisdiction": "federal_convicting_court"
  },
  {
    "node_id": "NODE-NO-EXTRAORDINARY-JUDICIAL-REMEDY",
    "label": "No extraordinary judicial remedy identified",
    "node_type": "status",
    "module_id": "MOD-EXTRAORDINARY-WRITS-CORAM-AUDITA-MANDAMUS",
    "claim_ids": [
      "CLM-XWRIT-004",
      "CLM-XWRIT-016",
      "CLM-XWRIT-025"
    ],
    "jurisdiction": "federal_nationwide"
  },
  {
    "node_id": "NODE-AUDITA-QUERELA-SCREEN",
    "label": "Check controlling circuit audita querela law and genuine gap",
    "node_type": "decision",
    "module_id": "MOD-EXTRAORDINARY-WRITS-CORAM-AUDITA-MANDAMUS",
    "claim_ids": [
      "CLM-XWRIT-020",
      "CLM-XWRIT-021",
      "CLM-XWRIT-022",
      "CLM-XWRIT-023",
      "CLM-XWRIT-024",
      "CLM-XWRIT-025"
    ],
    "jurisdiction": "federal_circuit_specific"
  },
  {
    "node_id": "NODE-MANDAMUS-CLASSIFICATION",
    "label": "Classify appellate or district mandamus",
    "node_type": "decision",
    "module_id": "MOD-EXTRAORDINARY-WRITS-CORAM-AUDITA-MANDAMUS",
    "claim_ids": [
      "CLM-XWRIT-026",
      "CLM-XWRIT-027",
      "CLM-XWRIT-028"
    ],
    "jurisdiction": "federal_nationwide"
  },
  {
    "node_id": "NODE-MANDAMUS-APPELLATE-FILING",
    "label": "Prepare Rule 21 appellate mandamus petition",
    "node_type": "filing",
    "module_id": "MOD-EXTRAORDINARY-WRITS-CORAM-AUDITA-MANDAMUS",
    "claim_ids": [
      "CLM-XWRIT-029",
      "CLM-XWRIT-030",
      "CLM-XWRIT-031",
      "CLM-XWRIT-032",
      "CLM-XWRIT-033",
      "CLM-XWRIT-034"
    ],
    "jurisdiction": "appropriate_federal_court_of_appeals"
  },
  {
    "node_id": "NODE-MANDAMUS-DISTRICT-FILING",
    "label": "Analyze § 1361 district mandamus action",
    "node_type": "filing",
    "module_id": "MOD-EXTRAORDINARY-WRITS-CORAM-AUDITA-MANDAMUS",
    "claim_ids": [
      "CLM-XWRIT-027",
      "CLM-XWRIT-028"
    ],
    "jurisdiction": "appropriate_federal_district_court"
  },
  {
    "node_id": "NODE-CLEMENCY-CLASSIFICATION",
    "label": "Classify federal executive clemency request",
    "node_type": "decision",
    "module_id": "MOD-EXECUTIVE-CLEMENCY-PARDON-COMMUTATION",
    "claim_ids": [
      "CLM-CLEM-001",
      "CLM-CLEM-002",
      "CLM-CLEM-003",
      "CLM-CLEM-004",
      "CLM-CLEM-007"
    ],
    "jurisdiction": "president_of_the_united_states"
  },
  {
    "node_id": "NODE-PARDON-PETITION",
    "label": "Prepare current pardon application",
    "node_type": "filing",
    "module_id": "MOD-EXECUTIVE-CLEMENCY-PARDON-COMMUTATION",
    "claim_ids": [
      "CLM-CLEM-008",
      "CLM-CLEM-009",
      "CLM-CLEM-010",
      "CLM-CLEM-011"
    ],
    "jurisdiction": "office_of_the_pardon_attorney_advisory_process"
  },
  {
    "node_id": "NODE-COMMUTATION-PETITION",
    "label": "Prepare current commutation application",
    "node_type": "filing",
    "module_id": "MOD-EXECUTIVE-CLEMENCY-PARDON-COMMUTATION",
    "claim_ids": [
      "CLM-CLEM-008",
      "CLM-CLEM-012",
      "CLM-CLEM-027"
    ],
    "jurisdiction": "office_of_the_pardon_attorney_advisory_process"
  },
  {
    "node_id": "NODE-CLEMENCY-PRESIDENTIAL-DECISION",
    "label": "Presidential clemency decision and warrant terms",
    "node_type": "remedy",
    "module_id": "MOD-EXECUTIVE-CLEMENCY-PARDON-COMMUTATION",
    "claim_ids": [
      "CLM-CLEM-005",
      "CLM-CLEM-006",
      "CLM-CLEM-017",
      "CLM-CLEM-018",
      "CLM-CLEM-028",
      "CLM-CLEM-029"
    ],
    "jurisdiction": "president_of_the_united_states"
  },
  {
    "node_id": "NODE-SENTENCE-MODIFICATION-CLASSIFICATION",
    "label": "Classify postjudgment sentence or record request",
    "node_type": "decision",
    "module_id": "MOD-RULES-35-36-MODIFICATION-APPEALS",
    "claim_ids": [
      "CLM-R3536-001",
      "CLM-R3536-002",
      "CLM-R3536-003",
      "CLM-R3536-034"
    ],
    "jurisdiction": "federal_sentencing_court"
  },
  {
    "node_id": "NODE-RULE35A-SCREEN",
    "label": "Screen Rule 35(a) clear error and fourteen-day authority",
    "node_type": "decision",
    "module_id": "MOD-RULES-35-36-MODIFICATION-APPEALS",
    "claim_ids": [
      "CLM-R3536-004",
      "CLM-R3536-005",
      "CLM-R3536-006",
      "CLM-R3536-007",
      "CLM-R3536-008",
      "CLM-R3536-009",
      "CLM-R3536-010",
      "CLM-R3536-011",
      "CLM-R3536-012"
    ],
    "jurisdiction": "federal_sentencing_court"
  },
  {
    "node_id": "NODE-RULE35A-CORRECTION",
    "label": "Correct qualifying Rule 35(a) error",
    "node_type": "remedy",
    "module_id": "MOD-RULES-35-36-MODIFICATION-APPEALS",
    "claim_ids": [
      "CLM-R3536-004",
      "CLM-R3536-008",
      "CLM-R3536-012"
    ],
    "jurisdiction": "federal_sentencing_court"
  },
  {
    "node_id": "NODE-RULE35B-GOVERNMENT-MOTION-SCREEN",
    "label": "Screen government Rule 35(b) motion and timing",
    "node_type": "decision",
    "module_id": "MOD-RULES-35-36-MODIFICATION-APPEALS",
    "claim_ids": [
      "CLM-R3536-013",
      "CLM-R3536-014",
      "CLM-R3536-015",
      "CLM-R3536-016",
      "CLM-R3536-017",
      "CLM-R3536-018",
      "CLM-R3536-019",
      "CLM-R3536-020",
      "CLM-R3536-021",
      "CLM-R3536-022",
      "CLM-R3536-023",
      "CLM-R3536-024"
    ],
    "jurisdiction": "federal_sentencing_court"
  },
  {
    "node_id": "NODE-RULE35B-REDUCTION",
    "label": "Decide qualifying Rule 35(b) reduction",
    "node_type": "remedy",
    "module_id": "MOD-RULES-35-36-MODIFICATION-APPEALS",
    "claim_ids": [
      "CLM-R3536-018",
      "CLM-R3536-019",
      "CLM-R3536-020",
      "CLM-R3536-025"
    ],
    "jurisdiction": "federal_sentencing_court"
  },
  {
    "node_id": "NODE-RULE36-SCREEN",
    "label": "Classify clerical record error versus substantive change",
    "node_type": "decision",
    "module_id": "MOD-RULES-35-36-MODIFICATION-APPEALS",
    "claim_ids": [
      "CLM-R3536-026",
      "CLM-R3536-027",
      "CLM-R3536-028",
      "CLM-R3536-029",
      "CLM-R3536-030",
      "CLM-R3536-031",
      "CLM-R3536-032",
      "CLM-R3536-033"
    ],
    "jurisdiction": "federal_sentencing_court"
  },
  {
    "node_id": "NODE-RULE36-CORRECTION",
    "label": "Correct qualifying clerical record error",
    "node_type": "remedy",
    "module_id": "MOD-RULES-35-36-MODIFICATION-APPEALS",
    "claim_ids": [
      "CLM-R3536-027",
      "CLM-R3536-028",
      "CLM-R3536-029",
      "CLM-R3536-033"
    ],
    "jurisdiction": "federal_sentencing_court"
  },
  {
    "node_id": "NODE-CRACK-REDUCTION-CLASSIFICATION",
    "label": "Classify § 404 versus § 3582(c)(2) crack route",
    "node_type": "decision",
    "module_id": "MOD-RULES-35-36-MODIFICATION-APPEALS",
    "claim_ids": [
      "CLM-R3536-034",
      "CLM-R3536-035",
      "CLM-R3536-036",
      "CLM-R3536-037"
    ],
    "jurisdiction": "federal_sentencing_court"
  },
  {
    "node_id": "NODE-SENTENCE-MODIFICATION-ORDER",
    "label": "Sentence-modification or record-correction order",
    "node_type": "status",
    "module_id": "MOD-RULES-35-36-MODIFICATION-APPEALS",
    "claim_ids": [
      "CLM-R3536-025",
      "CLM-R3536-033",
      "CLM-R3536-037"
    ],
    "jurisdiction": "federal_sentencing_court"
  },
  {
    "node_id": "NODE-SENTENCE-MODIFICATION-APPEAL",
    "label": "Classify and preserve appeal from postjudgment order",
    "node_type": "filing",
    "module_id": "MOD-RULES-35-36-MODIFICATION-APPEALS",
    "claim_ids": [
      "CLM-R3536-038",
      "CLM-R3536-039",
      "CLM-R3536-040",
      "CLM-R3536-041",
      "CLM-R3536-042",
      "CLM-R3536-043",
      "CLM-R3536-044"
    ],
    "jurisdiction": "federal_court_of_appeals"
  },
  {
    "node_id": "NODE-BOP-EXECUTION-CLASSIFICATION",
    "label": "Classify BOP sentence-execution issue",
    "node_type": "decision",
    "module_id": "MOD-BOP-DESIGNATION-SENTENCE-COMPUTATION",
    "claim_ids": [
      "CLM-BOPSC-025",
      "CLM-BOPSC-034"
    ],
    "jurisdiction": "federal_bureau_of_prisons"
  },
  {
    "node_id": "NODE-BOP-SENTENCE-COMPUTATION",
    "label": "Audit commencement, aggregation, and prior-custody credit",
    "node_type": "event",
    "module_id": "MOD-BOP-DESIGNATION-SENTENCE-COMPUTATION",
    "claim_ids": [
      "CLM-BOPSC-011",
      "CLM-BOPSC-015",
      "CLM-BOPSC-016",
      "CLM-BOPSC-018",
      "CLM-BOPSC-033"
    ],
    "jurisdiction": "federal_bureau_of_prisons"
  },
  {
    "node_id": "NODE-BOP-DESIGNATION-PROGRAM",
    "label": "Classify designation, concurrency, RDAP, or detainer consequence",
    "node_type": "decision",
    "module_id": "MOD-BOP-DETAINERS-DISCIPLINE-RDAP",
    "claim_ids": [
      "CLM-BOPSC-002",
      "CLM-BOPSC-009",
      "CLM-BOPDDR-005",
      "CLM-BOPDDR-039"
    ],
    "jurisdiction": "federal_bureau_of_prisons"
  },
  {
    "node_id": "NODE-BOP-PRERELEASE-PLACEMENT",
    "label": "Classify GCT, prerelease, home confinement, or release",
    "node_type": "decision",